{
  "$schema": "../../task.schema.json",
  "id": "task-janitor",
  "description": "Cleans up after the scheduler and the executor: re-queues items stuck past their period, repairs items a torn transition left without a state label, and reviews the health of the open set.",
  "frequency": "daily",
  "expected_outcome": "no_code_changes",
  "code_work": "node worker.mjs",
  "code_work_timeout": 300
}
