{
  "$schema": "../../../claudinite-tasks/task.schema.json",
  "id": "adopt-requested-packs",
  "description": "The member half of the fleet fan-out: adopts the packs an add-packs work list asks for, in this repository, by this repository's own agent.",
  "frequency": "manual",
  "expected_outcome": "fresh_pr",
  "automerge": [
    "claudinite-shared-packs",
    "claudinite-settings-updates",
    "generated-file-changes"
  ],
  "agent_model": "sonnet",
  "agent_instructions": "task.md",
  "agent_execution_timeout": 3600
}
